{
  "$schema": "https://json-schema.org/draft/2020-12/schema",
  "title": "SP16 v0.11 built-up beam-column and combined local stability case",
  "type": "object",
  "additionalProperties": false,
  "required": [
    "case_id",
    "standard",
    "action",
    "sections_9_3_and_9_4_applicability_confirmed",
    "eccentricity_mm",
    "gross_area_mm2",
    "compressed_branch_axis_distance_mm",
    "free_axis_inertia_mm4",
    "relative_effective_slenderness",
    "central_compression_phi",
    "moment_y_n_mm",
    "spacing_b1_mm",
    "moment_x_n_mm",
    "spacing_b2_mm",
    "base_branch_axial_force_n",
    "actual_shear_force_n",
    "fictitious_shear_force_n",
    "effective_web_height_mm",
    "web_thickness_mm",
    "design_yield_resistance_n_mm2",
    "elastic_modulus_n_mm2",
    "member_relative_slenderness_x",
    "member_relative_slenderness_y",
    "relative_eccentricity_mx",
    "relative_eccentricity_my",
    "central_compression_web_limit",
    "bending_member_web_limit_m20",
    "sigma_1_n_mm2",
    "sigma_2_n_mm2",
    "average_shear_stress_n_mm2",
    "c_cr",
    "working_condition_factor",
    "flange_width_mm",
    "axial_force_n",
    "axial_stability_utilization",
    "central_compression_flange_limit",
    "bending_member_flange_limit_m20",
    "effective_flange_outstand_mm",
    "flange_thickness_mm",
    "edge_return_applicable",
    "two_plane_condition_governing_confirmed"
  ],
  "properties": {
    "case_id": {
      "type": "string"
    },
    "standard": {
      "type": "string"
    },
    "action": {
      "type": "string",
      "const": "built_up_beam_columns_and_combined_local_stability"
    },
    "sections_9_3_and_9_4_applicability_confirmed": {
      "type": "boolean",
      "const": true
    },
    "eccentricity_mm": {
      "type": "number",
      "minimum": 0
    },
    "moment_y_n_mm": {
      "type": "number",
      "minimum": 0
    },
    "moment_x_n_mm": {
      "type": "number",
      "minimum": 0
    },
    "base_branch_axial_force_n": {
      "type": "number",
      "minimum": 0
    },
    "actual_shear_force_n": {
      "type": "number",
      "minimum": 0
    },
    "fictitious_shear_force_n": {
      "type": "number",
      "minimum": 0
    },
    "relative_effective_slenderness": {
      "type": "number",
      "minimum": 0
    },
    "relative_eccentricity_mx": {
      "type": "number",
      "minimum": 0
    },
    "relative_eccentricity_my": {
      "type": "number",
      "minimum": 0
    },
    "member_relative_slenderness_x": {
      "type": "number",
      "minimum": 0
    },
    "member_relative_slenderness_y": {
      "type": "number",
      "minimum": 0
    },
    "average_shear_stress_n_mm2": {
      "type": "number",
      "minimum": 0
    },
    "axial_stability_utilization": {
      "type": "number",
      "minimum": 0
    },
    "gross_area_mm2": {
      "type": "number",
      "exclusiveMinimum": 0
    },
    "compressed_branch_axis_distance_mm": {
      "type": "number",
      "exclusiveMinimum": 0
    },
    "free_axis_inertia_mm4": {
      "type": "number",
      "exclusiveMinimum": 0
    },
    "central_compression_phi": {
      "type": "number",
      "exclusiveMinimum": 0
    },
    "spacing_b1_mm": {
      "type": "number",
      "exclusiveMinimum": 0
    },
    "spacing_b2_mm": {
      "type": "number",
      "exclusiveMinimum": 0
    },
    "effective_web_height_mm": {
      "type": "number",
      "exclusiveMinimum": 0
    },
    "web_thickness_mm": {
      "type": "number",
      "exclusiveMinimum": 0
    },
    "design_yield_resistance_n_mm2": {
      "type": "number",
      "exclusiveMinimum": 0
    },
    "elastic_modulus_n_mm2": {
      "type": "number",
      "exclusiveMinimum": 0
    },
    "central_compression_web_limit": {
      "type": "number",
      "exclusiveMinimum": 0
    },
    "bending_member_web_limit_m20": {
      "type": "number",
      "exclusiveMinimum": 0
    },
    "sigma_1_n_mm2": {
      "type": "number",
      "exclusiveMinimum": 0
    },
    "c_cr": {
      "type": "number",
      "exclusiveMinimum": 0
    },
    "working_condition_factor": {
      "type": "number",
      "exclusiveMinimum": 0
    },
    "flange_width_mm": {
      "type": "number",
      "exclusiveMinimum": 0
    },
    "axial_force_n": {
      "type": "number",
      "exclusiveMinimum": 0
    },
    "central_compression_flange_limit": {
      "type": "number",
      "exclusiveMinimum": 0
    },
    "bending_member_flange_limit_m20": {
      "type": "number",
      "exclusiveMinimum": 0
    },
    "effective_flange_outstand_mm": {
      "type": "number",
      "exclusiveMinimum": 0
    },
    "flange_thickness_mm": {
      "type": "number",
      "exclusiveMinimum": 0
    },
    "sigma_2_n_mm2": {
      "type": "number"
    },
    "edge_return_applicable": {
      "type": "boolean"
    },
    "two_plane_condition_governing_confirmed": {
      "type": "boolean",
      "const": true
    }
  }
}
