{
  "case_id": "V11-BUILTUP-BEAM-COLUMN-EXAMPLE",
  "standard": "СП 16.13330.2017",
  "action": "built_up_beam_columns_and_combined_local_stability",
  "sections_9_3_and_9_4_applicability_confirmed": true,
  "eccentricity_mm": 80.0,
  "gross_area_mm2": 12000.0,
  "compressed_branch_axis_distance_mm": 300.0,
  "free_axis_inertia_mm4": 144000000.0,
  "relative_effective_slenderness": 2.0,
  "central_compression_phi": 0.826,
  "moment_y_n_mm": 120000000.0,
  "spacing_b1_mm": 600.0,
  "moment_x_n_mm": 60000000.0,
  "spacing_b2_mm": 500.0,
  "base_branch_axial_force_n": 500000.0,
  "actual_shear_force_n": 80000.0,
  "fictitious_shear_force_n": 60000.0,
  "effective_web_height_mm": 600.0,
  "web_thickness_mm": 10.0,
  "design_yield_resistance_n_mm2": 355.0,
  "elastic_modulus_n_mm2": 206000.0,
  "member_relative_slenderness_x": 2.5,
  "member_relative_slenderness_y": 1.8,
  "relative_eccentricity_mx": 6.0,
  "relative_eccentricity_my": 1.2,
  "central_compression_web_limit": 2.0,
  "bending_member_web_limit_m20": 2.5,
  "sigma_1_n_mm2": 180.0,
  "sigma_2_n_mm2": -60.0,
  "average_shear_stress_n_mm2": 30.0,
  "c_cr": 15.5,
  "working_condition_factor": 1.0,
  "flange_width_mm": 700.0,
  "axial_force_n": 1000000.0,
  "axial_stability_utilization": 0.85,
  "central_compression_flange_limit": 0.65,
  "bending_member_flange_limit_m20": 0.55,
  "effective_flange_outstand_mm": 150.0,
  "flange_thickness_mm": 16.0,
  "edge_return_applicable": true,
  "two_plane_condition_governing_confirmed": true
}
